{
  "version": 1,
  "durationMs": 8000,
  "stage": {
    "width": 1000,
    "height": 700
  },
  "actors": [
    {
      "id": "a",
      "shape": "circle",
      "color": "violet",
      "keyframes": [
        {
          "tMs": 0,
          "x": 260,
          "y": 350,
          "rotationDeg": 0,
          "scaleX": 1,
          "scaleY": 1,
          "easing": "easeInOut"
        },
        {
          "tMs": 1500,
          "x": 400,
          "y": 350,
          "rotationDeg": 0,
          "scaleX": 1,
          "scaleY": 1,
          "easing": "easeInOut"
        },
        {
          "tMs": 3000,
          "x": 410,
          "y": 350,
          "rotationDeg": 0,
          "scaleX": 1,
          "scaleY": 1,
          "easing": "easeInOut"
        },
        {
          "tMs": 5000,
          "x": 380,
          "y": 350,
          "rotationDeg": 0,
          "scaleX": 1,
          "scaleY": 1,
          "easing": "easeInOut"
        },
        {
          "tMs": 6500,
          "x": 380,
          "y": 350,
          "rotationDeg": 0,
          "scaleX": 1,
          "scaleY": 1,
          "easing": "easeInOut"
        },
        {
          "tMs": 8000,
          "x": 380,
          "y": 350,
          "rotationDeg": 0,
          "scaleX": 1,
          "scaleY": 1,
          "easing": "linear"
        }
      ]
    },
    {
      "id": "b",
      "shape": "square",
      "color": "amber",
      "keyframes": [
        {
          "tMs": 0,
          "x": 650,
          "y": 350,
          "rotationDeg": 0,
          "scaleX": 1,
          "scaleY": 1,
          "easing": "easeInOut"
        },
        {
          "tMs": 1500,
          "x": 650,
          "y": 350,
          "rotationDeg": 0,
          "scaleX": 1,
          "scaleY": 1,
          "easing": "easeInOut"
        },
        {
          "tMs": 3000,
          "x": 700,
          "y": 350,
          "rotationDeg": 12,
          "scaleX": 1,
          "scaleY": 1,
          "easing": "easeInOut"
        },
        {
          "tMs": 5000,
          "x": 550,
          "y": 350,
          "rotationDeg": 0,
          "scaleX": 1,
          "scaleY": 1,
          "easing": "easeInOut"
        },
        {
          "tMs": 6500,
          "x": 530,
          "y": 350,
          "rotationDeg": 0,
          "scaleX": 1,
          "scaleY": 1,
          "easing": "easeInOut"
        },
        {
          "tMs": 8000,
          "x": 530,
          "y": 350,
          "rotationDeg": 0,
          "scaleX": 1,
          "scaleY": 1,
          "easing": "linear"
        }
      ]
    }
  ]
}
