{
  "version": 1,
  "durationMs": 8000,
  "stage": {
    "width": 1000,
    "height": 700
  },
  "actors": [
    {
      "id": "a",
      "shape": "square",
      "color": "violet",
      "keyframes": [
        {
          "tMs": 0,
          "x": 270,
          "y": 350,
          "rotationDeg": 0,
          "scaleX": 1,
          "scaleY": 1,
          "easing": "easeInOut"
        },
        {
          "tMs": 1000,
          "x": 270,
          "y": 350,
          "rotationDeg": 0,
          "scaleX": 1,
          "scaleY": 1,
          "easing": "easeInOut"
        },
        {
          "tMs": 1750,
          "x": 270,
          "y": 280,
          "rotationDeg": 0,
          "scaleX": 1,
          "scaleY": 1,
          "easing": "easeInOut"
        },
        {
          "tMs": 2150,
          "x": 270,
          "y": 280,
          "rotationDeg": 0,
          "scaleX": 1,
          "scaleY": 1,
          "easing": "easeInOut"
        },
        {
          "tMs": 2900,
          "x": 200,
          "y": 280,
          "rotationDeg": 0,
          "scaleX": 1,
          "scaleY": 1,
          "easing": "easeInOut"
        },
        {
          "tMs": 3250,
          "x": 200,
          "y": 280,
          "rotationDeg": 0,
          "scaleX": 1,
          "scaleY": 1,
          "easing": "easeInOut"
        },
        {
          "tMs": 4250,
          "x": 200,
          "y": 420,
          "rotationDeg": 0,
          "scaleX": 1,
          "scaleY": 1,
          "easing": "easeInOut"
        },
        {
          "tMs": 4750,
          "x": 200,
          "y": 420,
          "rotationDeg": 0,
          "scaleX": 1,
          "scaleY": 1,
          "easing": "easeInOut"
        },
        {
          "tMs": 5500,
          "x": 270,
          "y": 420,
          "rotationDeg": 0,
          "scaleX": 1,
          "scaleY": 1,
          "easing": "easeInOut"
        },
        {
          "tMs": 6250,
          "x": 270,
          "y": 350,
          "rotationDeg": 0,
          "scaleX": 1,
          "scaleY": 1,
          "easing": "easeInOut"
        },
        {
          "tMs": 8000,
          "x": 270,
          "y": 350,
          "rotationDeg": 0,
          "scaleX": 1,
          "scaleY": 1,
          "easing": "linear"
        }
      ]
    },
    {
      "id": "b",
      "shape": "triangle",
      "color": "amber",
      "keyframes": [
        {
          "tMs": 0,
          "x": 730,
          "y": 350,
          "rotationDeg": 0,
          "scaleX": 1,
          "scaleY": 1,
          "easing": "easeInOut"
        },
        {
          "tMs": 2000,
          "x": 730,
          "y": 350,
          "rotationDeg": 0,
          "scaleX": 1,
          "scaleY": 1,
          "easing": "easeInOut"
        },
        {
          "tMs": 2750,
          "x": 730,
          "y": 280,
          "rotationDeg": 0,
          "scaleX": 1,
          "scaleY": 1,
          "easing": "easeInOut"
        },
        {
          "tMs": 3150,
          "x": 730,
          "y": 280,
          "rotationDeg": 0,
          "scaleX": 1,
          "scaleY": 1,
          "easing": "easeInOut"
        },
        {
          "tMs": 3900,
          "x": 660,
          "y": 280,
          "rotationDeg": 0,
          "scaleX": 1,
          "scaleY": 1,
          "easing": "easeInOut"
        },
        {
          "tMs": 4250,
          "x": 660,
          "y": 280,
          "rotationDeg": 0,
          "scaleX": 1,
          "scaleY": 1,
          "easing": "easeInOut"
        },
        {
          "tMs": 5250,
          "x": 660,
          "y": 420,
          "rotationDeg": 0,
          "scaleX": 1,
          "scaleY": 1,
          "easing": "easeInOut"
        },
        {
          "tMs": 5750,
          "x": 660,
          "y": 420,
          "rotationDeg": 0,
          "scaleX": 1,
          "scaleY": 1,
          "easing": "easeInOut"
        },
        {
          "tMs": 6500,
          "x": 730,
          "y": 420,
          "rotationDeg": 0,
          "scaleX": 1,
          "scaleY": 1,
          "easing": "easeInOut"
        },
        {
          "tMs": 7250,
          "x": 730,
          "y": 350,
          "rotationDeg": 0,
          "scaleX": 1,
          "scaleY": 1,
          "easing": "easeInOut"
        },
        {
          "tMs": 8000,
          "x": 730,
          "y": 350,
          "rotationDeg": 0,
          "scaleX": 1,
          "scaleY": 1,
          "easing": "linear"
        }
      ]
    }
  ]
}
